{
  "schemaVersion": "fenrua.authority-policy.v1",
  "policyId": "urn:fenrua:policy:demo-allow-tool",
  "scope": {
    "tenantId": "urn:fenrua:tenant:demo",
    "environmentId": "urn:fenrua:environment:development"
  },
  "revision": "1",
  "lifecycle": "active",
  "issuerId": "urn:fenrua:organisation:fenrua",
  "issuedAt": "2026-07-14T00:00:00.000Z",
  "effectiveAt": "2026-07-14T00:00:00.000Z",
  "expiresAt": "2026-07-15T00:00:00.000Z",
  "rules": [
    {
      "ruleId": "urn:fenrua:rule:allow-demo-agent",
      "effect": "ALLOW",
      "subjectSelector": {
        "ids": ["urn:fenrua:entity:demo-agent"]
      },
      "actorSelector": {
        "ids": ["urn:fenrua:actor:demo-operator"]
      },
      "actions": ["tool.execute"],
      "resources": ["artifact:demo-build"],
      "scope": {
        "tenantId": "urn:fenrua:tenant:demo",
        "environmentId": "urn:fenrua:environment:development"
      },
      "requiredIntegrityDigests": [
        {
          "algorithm": "sha-256",
          "value": "aaaaaaaaaaaaaaaaaaaaaaaaaaaaaaaaaaaaaaaaaaaaaaaaaaaaaaaaaaaaaaaa"
        }
      ],
      "requiredEvidence": ["build-provenance"],
      "requiredApprovals": [
        {
          "approvalType": "operator-approval",
          "minimumCount": 1
        }
      ],
      "obligations": [
        {
          "code": "record-evidence",
          "description": "Record a local evidence bundle before reporting a result."
        }
      ],
      "reasonCode": "ALLOW_POLICY_MATCH"
    }
  ],
  "integrity": {
    "algorithm": "sha-256",
    "value": "aaaaaaaaaaaaaaaaaaaaaaaaaaaaaaaaaaaaaaaaaaaaaaaaaaaaaaaaaaaaaaaa"
  },
  "evidenceRefs": [
    {
      "evidenceBundleId": "urn:fenrua:evidence-bundle:bootstrap-evidence",
      "digest": {
        "algorithm": "sha-256",
        "value": "aaaaaaaaaaaaaaaaaaaaaaaaaaaaaaaaaaaaaaaaaaaaaaaaaaaaaaaaaaaaaaaa"
      },
      "createdAt": "2026-07-14T00:00:00.000Z"
    }
  ],
  "signature": {
    "profile": "local-unsigned-development",
    "keyId": "urn:fenrua:key:local-unsigned-development",
    "payloadDigest": {
      "algorithm": "sha-256",
      "value": "aaaaaaaaaaaaaaaaaaaaaaaaaaaaaaaaaaaaaaaaaaaaaaaaaaaaaaaaaaaaaaaa"
    }
  }
}
